{
  "id": "{{ID}}",
  "name": "{{NAME}}",
  "version": "1.0.0",
  "description": "{{DESCRIPTION}}",
  "author": "{{AUTHOR}}",
  "category": [],
  "entry": "index.html",
  "icon": "icon.svg",
  "keyword": "{{NAME}} {{ID}}",
  "window": {
    "width": 540,
    "height": 380,
    "minWidth": 320,
    "minHeight": 240,
    "resizable": false,
    "singleInstance": true,
    "controls": {
      "minimize": false,
      "maximize": false
    }
  },
  "targets": [
    {
      "id": "windows-electron-x64",
      "platform": "windows",
      "runtime": "electron",
      "arch": "x64"
    }
  ],
  "nativeComponents": [],
  "features": [
    {
      "code": "execute",
      "explain": "{{NAME}} 快速功能触发",
      "cmds": ["{{NAME}}", "{{ID}}"]
    }
  ]
}
