{
  "id": "{{ID}}",
  "name": "{{NAME}}",
  "version": "1.0.0",
  "description": "{{DESCRIPTION}}",
  "author": "{{AUTHOR}}",
  "category": [],
  "entry": "index.html",
  "icon": "icon.svg",
  "keyword": "{{NAME}} {{ID}}",
  "window": {
    "width": 800,
    "height": 600,
    "minWidth": 480,
    "minHeight": 360,
    "resizable": true,
    "singleInstance": true,
    "controls": {
      "minimize": true,
      "maximize": true
    }
  },
  "targets": [
    {
      "id": "windows-electron-x64",
      "platform": "windows",
      "runtime": "electron",
      "arch": "x64"
    }
  ],
  "nativeComponents": [],
  "features": [
    {
      "code": "main",
      "explain": "{{NAME}}",
      "cmds": ["{{NAME}}", "{{ID}}"]
    }
  ]
}
